{
  "id": "task-6-create-a-corpus-informed-request-troubleshooting-guide-and-focused-faq--b33ed474",
  "text": "Create a corpus-informed request troubleshooting guide and focused FAQ category for testing requests, interpreting failures, and isolating configuration problems.",
  "goalId": "goal-build-a-production-informed-apiease-faq-and-close-recurring-documentati-c6b1c671",
  "goal": "# Build a production-informed APIEase FAQ and close recurring documentation gaps\n\n## Objective\n\nUse the complete production AI conversation export at `/Users/kevin/Downloads/apiease-production.aiConversations.json` as evidence of what APIEase customers try to accomplish, misunderstand, and struggle to troubleshoot. Expand the public APIEase FAQ and improve the supporting documentation so customers and Apex can retrieve concise, authoritative answers.\n\nThis is a documentation goal. Make changes in `apiease-docs`; use sibling repositories only as read-only sources of truth unless the user separately authorizes implementation changes elsewhere. Do not change Apex prompts or product behavior as part of this goal. Durable product knowledge should live in the documentation and flow into the generated knowledge base.\n\n## Source data and integrity checks\n\nThe supplied export is production data and must remain outside the repository. At the time this goal was prepared, it contained:\n\n- 377 stored conversation documents\n- 371 distinct `apiEaseConversationId` values\n- 3,811 messages in total\n- 1,681 messages whose role is `user`\n- Six conversations split across multiple chunks\n- No duplicate `(apiEaseConversationId, messageIndex)` pairs\n\nBefore analysis, verify these invariants against the source file. If the file is missing, unreadable, structurally different, or has materially different totals, stop and ask the user how to proceed rather than silently analyzing a partial corpus.\n\nReconstruct each complete conversation by grouping records on `apiEaseConversationId`, ordering records by `chunkIndex`, and ordering their messages by `messageIndex`. Use assistant messages only to understand the customer's context, follow-up, correction, or failed explanation. Historical assistant answers are not authoritative evidence of APIEase behavior.\n\nEvery user message must be accounted for during analysis, including short follow-ups, corrections, repeated questions, errors, and expressions of frustration. A follow-up may contribute context to the same information need instead of becoming its own FAQ question, but it may not be silently dropped. Exclude only spam, abuse, accidental secrets, and content unrelated to APIEase use, and retain a sanitized aggregate reason for each exclusion category.\n\nTreat repeated starter prompts, generated suggestions, exact duplicates, and boilerplate separately from organic customer questions so they do not distort frequency rankings. They still count as messages considered and may still reveal a real information need. Do not infer that all repeated wording is synthetic merely because it is repeated.\n\n## Production-data safety\n\nThe export may contain real domains, names, email addresses, account details, request IDs, URLs, credentials, tokens, and other sensitive or identifying data.\n\n- Never copy or move the export into this repository.\n- Never commit raw messages, conversation identifiers, shop domains, secrets, credential-like strings, or customer-specific payloads as source, fixtures, snapshots, examples, or analysis artifacts.\n- Do not send the export or raw excerpts to external services.\n- Keep terminal and tool output aggregate-only; do not print raw messages while analyzing the corpus.\n- Do not quote customer messages in documentation or committed analysis. Capture wording patterns only as sanitized paraphrases and generic synonyms.\n- Use unmistakably fictional placeholders such as `YOUR_API_KEY`, `YOUR_ACCESS_TOKEN`, `your-store.myshopify.com`, and `example.com`.\n- If a temporary working analysis or canonical inventory is needed between tasks, keep it outside Docusaurus content and out of git, make it aggregate and sanitized, and remove it after the goal is complete. The production JSON must remain the only raw source-data file.\n\n## Evidence and answer-validation rules\n\nCustomer messages are demand signals, not sources of truth. Validate every published statement about APIEase against the current product and supported public contracts.\n\nUse this evidence in order:\n\n1. Inspect the current documentation in this repository, including related pages rather than only the FAQ.\n2. Inspect current APIEase implementation and tests under `../apiease` when the docs are incomplete, ambiguous, or potentially outdated. Follow any applicable `AGENTS.md` files there. Do not expose private runtime objects, internal paths, or code-only fields in public docs.\n3. For recurring developer questions, inspect the relevant current public API, `apiease-cli`, or `apiease-template` source and documented contracts in their sibling repositories when those repositories are available.\n4. Use well-established technical standards and official provider documentation for general concepts, but do not turn provider-specific behavior into an APIEase promise.\n5. Ask the user, who is the APIEase subject-matter expert, whenever the sources still leave a product behavior, intended support policy, recommended workflow, terminology choice, or customer-facing answer unresolved.\n\nDo not invent an answer, choose among conflicting sources silently, or preserve a historical Apex answer merely because it sounds plausible. When code and documentation disagree, determine whether the documentation is stale or the implementation is incidental; ask the user if intended behavior remains uncertain.\n\n## Required subject-matter-expert checkpoint\n\nAnalyze and validate before making documentation changes that depend on uncertain answers. Exhaust the existing docs, relevant code, and well-understood technical knowledge first so the user is not asked questions that can be answered reliably from available evidence.\n\nFor each genuine ambiguity, present the user with a concise, numbered question that includes:\n\n- The underlying reusable customer need, without raw customer text or identifying details\n- What the current docs and code establish\n- The exact point that remains unknown or contradictory\n- The customer-facing consequence of the plausible answers\n- A recommendation only when the available evidence supports one\n\nUse a `user-checkup` before any downstream documentation task that would encode those answers. Proceed with unrelated, fully verified material when safe, but do not publish an affected answer until the user has responded. Incorporate the user's answers into the authoritative page and FAQ inventory. If a question remains unanswered, record it as unresolved in the completion summary and omit unsupported claims from public docs.\n\nThe task decomposition should put corpus analysis and the canonical inventory before documentation implementation so ambiguities can be surfaced early. Do not defer all questions until after the docs have been written.\n\n## Corpus analysis and canonical inventory\n\nDerive the taxonomy from the complete corpus rather than forcing messages into a predetermined list. Likely themes include, but are not limited to:\n\n- APIEase capabilities, limitations, and product orientation\n- Creating, editing, finding, duplicating, and deleting requests and other resources\n- Request types, HTTP methods, addresses, headers, bodies, and parameters\n- Credentials, tokens, permissions, sensitive values, and 401 or 403 errors\n- Shopify Admin API usage and automatic versus overridden Shopify access tokens\n- External APIs, suppliers, and the information required to configure an integration\n- Storefront calls, customer-authenticated requests, app proxy behavior, and CORS-related confusion\n- Manual, remote, webhook, cron, proxy, widget, and Shopify Flow triggers\n- Chained requests and multi-step integrations\n- Product, inventory, order, and customer synchronization patterns\n- Variables, Functions, Liquid requests, and System requests\n- Widgets, app blocks, app embeds, and storefront behavior\n- Testing requests, interpreting failures, and isolating configuration problems\n- APIEase API keys, the public API, CLI, template, and AI-agent workflows\n- Security boundaries and what APIEase can or cannot retrieve, reveal, inject, or generate\n\nFor each canonical information-need cluster, maintain a sanitized working inventory containing:\n\n- A stable, descriptive cluster name\n- Approximate frequency by distinct conversation and by user message\n- Sanitized customer terms and synonyms useful for documentation search and Apex retrieval\n- The actual customer objective and important variants\n- Whether current documentation answers it accurately and whether the answer is easy to find\n- Conflicts, outdated statements, and missing prerequisites found in existing docs\n- The proposed content disposition: FAQ entry, conceptual page, how-to guide, example, troubleshooting page, existing-page improvement, exclusion, or unresolved SME question\n- The narrowest authoritative existing page to link or the page that must be created or updated\n- The evidence used to validate the proposed answer\n\nReconcile the analysis at the end so all 1,681 user messages are represented by a cluster, contextual follow-up, or sanitized exclusion. Frequencies are prioritization signals, not an instruction to publish one entry per message. Consolidate equivalent questions without erasing meaningful distinctions such as an APIEase API key versus a Shopify access token.\n\nDo not commit a message-level ledger or publish corpus counts, rankings, internal conversation details, or analysis artifacts on the documentation site. Report only sanitized aggregate analysis in the goal completion summary.\n\n## Documentation design a